{
  "schemaVersion": 1,
  "sequence": 2,
  "issuedAt": "2026-08-01T01:00:00Z",
  "expiresAt": "2026-08-03T00:00:00Z",
  "previousDigest": "sha256:382bdf240eb09eb2b7ba8fa8283ecb3aecb3f5a13b514abdfd36e65f1a7af472",
  "payload": {
    "publisherLineages": [
      {
        "id": "example.release",
        "publisher": "example",
        "pluginIds": [
          "dev.example.echo"
        ],
        "keys": [
          {
            "keyId": "example.release:1",
            "algorithm": "ed25519",
            "publicKey": "d75a980182b10ab7d54bfed3c964073a0ee172f3daa62325af021a68f707511a",
            "validFrom": "2026-01-01T00:00:00Z",
            "validUntil": "2027-08-01T00:00:00Z"
          }
        ]
      }
    ],
    "releases": [
      {
        "pluginId": "dev.example.echo",
        "publisher": "example",
        "version": "1.0.0",
        "publisherKeyId": "example.release:1",
        "publisherLineage": "example.release",
        "jarvisRange": ">=0.4.0, <0.5.0",
        "pluginApi": 2,
        "target": "darwin-arm64",
        "minimumMacos": "14.0.0",
        "url": "https://plugins.jarvis.example/dev.example.echo/1.0.0/darwin-arm64.jarvis-plugin",
        "archiveDigest": "sha256:aaaaaaaaaaaaaaaaaaaaaaaaaaaaaaaaaaaaaaaaaaaaaaaaaaaaaaaaaaaaaaaa",
        "packageSignature": {
          "algorithm": "ed25519",
          "keyId": "example.release:1",
          "value": "gDDYgr16HoixPzQjmuL8+CTds3bPmnZlxOHqex3+FifEyJqpD8PHzZT5HUWX4tQrUrijxOGqKbQu/ZaPOSAjCQ=="
        },
        "revoked": false
      }
    ],
    "rootRotation": {
      "threshold": 1,
      "keys": [
        {
          "keyId": "jarvis.root:2",
          "algorithm": "ed25519",
          "publicKey": "d75a980182b10ab7d54bfed3c964073a0ee172f3daa62325af021a68f707511a",
          "validFrom": "2026-01-01T00:00:00Z",
          "validUntil": "2027-08-01T00:00:00Z"
        }
      ]
    },
    "revokedPackageDigests": [],
    "revokedPublisherKeys": []
  },
  "signatures": [
    {
      "algorithm": "ed25519",
      "keyId": "jarvis.root:1",
      "value": "YMCdnO9AG9pCV4l0V4ZmyuS/FnHPdrUqpOg8nJLBS7LyIHjlTldwjXb6gbz+PiDc7Vb00h7yR95JAnkK8PAGBA=="
    },
    {
      "algorithm": "ed25519",
      "keyId": "jarvis.root:2",
      "value": "YMCdnO9AG9pCV4l0V4ZmyuS/FnHPdrUqpOg8nJLBS7LyIHjlTldwjXb6gbz+PiDc7Vb00h7yR95JAnkK8PAGBA=="
    }
  ]
}
